workerid,strangedescription,trial_type,actual_utterance,actual_effect_question,name,object_level,gender,num_objects,object,effect,actual_cause,quantifier,rt,cause,response,other_gender,slide_number_in_experiment
27,I think some of the books would be ripped.,cause_effect_prior,"""None of the books ripped.""",Do you think Anthony is describing a normal event?,Ronald,object_high,M,15,books,ripped,Ronald used  15 books  as dog toys.,None,9665,used __ as dog toys,no,M,17
27,Doesn&quotechart make sense what is usual about it.,cause_effect_prior,"""As usual.""",Do you think Christopher is describing a normal event?,Gary,object_high,M,15,white carpets,got stained,Gary spilled red nail polish on  15 white carpets.,short_filler,14927,spilled red nail polish on __,no,M,18
27,,cause_effect_prior,"""All of the flashlights lit up.""",Do you think Brian is describing a normal event?,Jeffrey,object_high,M,15,flashlights,lit up,Jeffrey pressed the &quotecharon&quotechar button on  15 flashlights.,All,3353,pressed the &quotecharon&quotechar button on __,yes,M,19
27,,cause_effect_prior,"""Some of the balloons popped.""",Do you think Catherine is describing a normal event?,Heather,object_mid,F,15,balloons,popped,Heather poked  15 balloons  with a pin.,Some,3045,poked __ with a pin,yes,F,20
27,People don&quotechart microwave tin foil.,cause_effect_prior,"""Pretty normal.""",Do you think Emma is describing a normal event?,Margaret,object_mid,F,15,balls of tin foil,exploded,Margaret heated up  15 balls of tin foil  in a microwave.,short_filler,15983,heated up __ in a microwave,no,F,21
27,,cause_effect_prior,"""It&quotechars a beautiful day.""",Do you think Scott is describing a normal event?,Samuel,object_high,M,15,ice cubes,melted,Samuel left  15 ice cubes  in the hot sun.,long_filler,2855,left __ in the hot sun,yes,M,22
27,,cause_effect_prior,"""All of the mirrors reflected the sunlight.""",Do you think Sarah is describing a normal event?,Timothy,object_high,M,15,mirrors,reflected the sunlight,Timothy placed  15 mirrors  in the sun.,All,2744,placed __ in the sun,yes,F,23
27,The lights wouldn&quotechart have any effect on the environment.,cause_effect_prior,"""That&quotechars not very good for the environment.""",Do you think Deborah is describing a normal event?,Rachel,object_mid,F,15,old cars,beeped,Rachel left the lights on in  15 old cars.,long_filler,17751,left the lights on in __,no,F,24
27,,cause_effect_prior,"""It&quotechars so pretty.""",Do you think Michael is describing a normal event?,James,object_mid,M,15,songs,rhymed,James wrote  15 songs.,long_filler,2767,wrote __,yes,M,25
27,,cause_effect_prior,"""Nothing out of the ordinary.""",Do you think Sandra is describing a normal event?,Donna,object_low,F,15,toy cars,rolled,Donna pushed  15 toy cars.,short_filler,3808,pushed __,yes,F,26
27,They would definitely honk.,cause_effect_prior,"""None of the bus drivers honked.""",Do you think Andrew is describing a normal event?,Nicholas,object_mid,M,15,bus drivers,honked,Nicholas cut off  15 bus drivers.,None,9526,cut off __,no,M,27
27,,cause_effect_prior,"""All of the beads stuck.""",Do you think Mary is describing a normal event?,Dennis,object_low,M,15,beads,stuck,Dennis glued  15 beads  to a piece of paper.,All,5815,glued __ to a piece of paper,yes,F,28
27,,cause_effect_prior,"""Some of the block towers fell down.""",Do you think Jerry is describing a normal event?,Nicole,object_mid,F,15,block towers,fell down,Nicole punched  15 block towers.,Some,3024,punched __,yes,M,29
27,,cause_effect_prior,"""Some of the rocks burnt.""",Do you think Steven is describing a normal event?,Jason,object_low,M,15,rocks,burnt,Jason threw  15 rocks  into a fire.,Some,4232,threw __ into a fire,yes,M,30
27,,cause_effect_prior,"""Some of the cars stopped.""",Do you think Richard is describing a normal event?,George,object_high,M,15,cars,stopped,George pressed the brakes on  15 cars.,Some,6359,pressed the brakes on __,yes,M,31
27,,cause_effect_prior,"""I guess once a jokester, always a jokester.""",Do you think Kevin is describing a normal event?,Tyler,object_mid,M,15,comedians,laughed,Tyler told a joke to  15 comedians.,long_filler,3897,told a joke to __,yes,M,32
28,,cause_effect_prior,"""Nothing surprising there.""",Do you think Justin is describing a normal event?,Rachel,object_low,F,15,baseballs,stuck to the wall,Rachel threw  15 baseballs  against a wall.,short_filler,7979,threw __ against a wall,yes,M,3
28,,cause_effect_prior,"""As usual.""",Do you think Jonathan is describing a normal event?,Sandra,object_mid,F,15,white shirts,got stained,Sandra spilled red nail polish on  15 white shirts.,short_filler,5748,spilled red nail polish on __,yes,M,4
28,If he glued stickers to the paper you would assume they would have stuck.,cause_effect_prior,"""None of the stickers stuck.""",Do you think Larry is describing a normal event?,Gary,object_high,M,15,stickers,stuck,Gary glued  15 stickers  to a piece of paper.,None,39179,glued __ to a piece of paper,no,M,5
28,If she pressed the brakes on 15 bikes why did only some of them stop?,cause_effect_prior,"""Some of the bicycles stopped.""",Do you think Elizabeth is describing a normal event?,Kimberly,object_low,F,15,bicycles,stopped,Kimberly pressed the brakes on  15 bicycles.,Some,35006,pressed the brakes on __,no,F,6
28,I don&quotechart think they expected any of them to explode.,cause_effect_prior,"""Some of the gas tanks exploded.""",Do you think Emma is describing a normal event?,Timothy,object_high,M,15,gas tanks,exploded,Timothy lit  15 gas tanks.,Some,40202,lit __,no,F,7
28,,cause_effect_prior,"""Some of the pinecones decomposed.""",Do you think Thomas is describing a normal event?,Linda,object_mid,F,15,pinecones,decomposed,Linda put  15 pinecones  in a compost pile for a month.,Some,20537,put __ in a compost pile for a month,yes,M,8
28,,cause_effect_prior,"""All of the houses beeped.""",Do you think Donna is describing a normal event?,Julie,object_low,F,15,houses,beeped,Julie left the lights on in  15 houses.,All,8366,left the lights on in __,yes,F,9
28,,cause_effect_prior,"""Some of the birds ate the seeds.""",Do you think Diane is describing a normal event?,Samantha,object_high,F,15,birds,ate the seeds,Samantha left seeds out for  15 birds.,Some,6467,left seeds out for __,yes,F,10
28,,cause_effect_prior,"""Some of the laptops ran out of batteries.""",Do you think Dorothy is describing a normal event?,Donald,object_high,M,15,laptops,ran out of batteries,Donald left  15 laptops  on (and unplugged) all day.,Some,5994,left __ on (and unplugged) all day,yes,F,11
28,,cause_effect_prior,"""Some of the bananas were green.""",Do you think Jack is describing a normal event?,Helen,object_mid,F,15,bananas,were green,Helen saw  15 bananas.,Some,4366,saw __,yes,M,12
28,,cause_effect_prior,"""All of the notebooks landed flat.""",Do you think Anna is describing a normal event?,Christina,object_low,F,15,notebooks,landed flat,Christina tossed  15 notebooks.,All,5499,tossed __,yes,F,13
28,Sugar normally dissolves in liquid.,cause_effect_prior,"""None of the sugar cubes dissolved.""",Do you think Steven is describing a normal event?,Nicole,object_high,F,15,sugar cubes,dissolved,Nicole put  15 sugar cubes  in a bucket of water.,None,21257,put __ in a bucket of water,no,M,14
28,,cause_effect_prior,"""Typical.""",Do you think Margaret is describing a normal event?,Nicholas,object_mid,M,15,crayons,melted,Nicholas left  15 crayons  in the hot sun.,short_filler,6686,left __ in the hot sun,yes,F,15
28,,cause_effect_prior,"""Some people just love destruction.""",Do you think James is describing a normal event?,Karen,object_high,F,15,card towers,fell down,Karen punched  15 card towers.,long_filler,6290,punched __,yes,M,16
28,,cause_effect_prior,"""I just wish the weather was better.""",Do you think Virginia is describing a normal event?,Andrew,object_high,M,15,napkins,blew away,Andrew left  15 napkins  on a table on a windy day.,long_filler,5594,left __ on a table on a windy day,yes,F,17
28,,cause_effect_prior,"""None of the bicyclists honked.""",Do you think Frank is describing a normal event?,George,object_low,M,15,bicyclists,honked,George cut off  15 bicyclists.,None,30380,cut off __,yes,M,18
28,,cause_effect_prior,"""All of the limericks rhymed.""",Do you think Mary is describing a normal event?,Scott,object_high,M,15,limericks,rhymed,Scott wrote  15 limericks.,All,4549,wrote __,yes,F,19
28,Usually the players light up when powered on.,cause_effect_prior,"""None of the cd-players lit up.""",Do you think Stephanie is describing a normal event?,Brandon,object_low,M,15,cd-players,lit up,Brandon pressed the &quotecharon&quotechar button on  15 cd-players.,None,28356,pressed the &quotecharon&quotechar button on __,no,F,20
28,,cause_effect_prior,"""Some of the lawyers laughed.""",Do you think Michelle is describing a normal event?,Charles,object_low,M,15,lawyers,laughed,Charles told a joke to  15 lawyers.,Some,16415,told a joke to __,yes,F,21
28,,cause_effect_prior,"""All of the shirts ripped.""",Do you think Ronald is describing a normal event?,Jessica,object_mid,F,15,shirts,ripped,Jessica used  15 shirts  as dog toys.,All,4950,used __ as dog toys,yes,M,22
28,,cause_effect_prior,"""Why not just take them inside?""",Do you think Christopher is describing a normal event?,Kevin,object_low,M,15,phone screens,reflected the sunlight,Kevin placed  15 phone screens  in the sun.,long_filler,12814,placed __ in the sun,yes,M,23
28,All of the bubbles should have popped when poked.,cause_effect_prior,"""Some of the bubbles popped.""",Do you think Joyce is describing a normal event?,Kenneth,object_high,M,15,bubbles,popped,Kenneth poked  15 bubbles  with a pin.,Some,15806,poked __ with a pin,no,F,24
28,,cause_effect_prior,"""Nothing out of the ordinary.""",Do you think Paul is describing a normal event?,Brian,object_high,M,15,sunglasses,broke,Brian ran  15 sunglasses  over with a car.,short_filler,5299,ran __ over with a car,yes,M,25
28,,cause_effect_prior,"""Some of the wheelchairs rolled.""",Do you think David is describing a normal event?,Ashley,object_high,F,15,wheelchairs,rolled,Ashley pushed  15 wheelchairs.,Some,19041,pushed __,yes,M,26
28,They should have froze.,cause_effect_prior,"""None of the berries froze.""",Do you think Shirley is describing a normal event?,Ryan,object_high,M,15,berries,froze,Ryan put  15 berries  in the freezer.,None,17661,put __ in the freezer,no,F,27
28,,cause_effect_prior,"""Some of the webcams flashed.""",Do you think Mark is describing a normal event?,Daniel,object_low,M,15,webcams,flashed,Daniel took a picture with  15 webcams.,Some,8334,took a picture with __,yes,M,28
28,,cause_effect_prior,"""All of the novels had the letter Z in them.""",Do you think Benjamin is describing a normal event?,Sarah,object_high,F,15,novels,had the letter Z in them,Sarah wrote  15 novels.,All,11153,wrote __,yes,M,29
28,It&quotechars not the usual way to spend free time.,cause_effect_prior,"""That&quotechars one way of spending your free time.""",Do you think Amanda is describing a normal event?,Sharon,object_mid,F,15,balls of tin foil,exploded,Sharon heated up  15 balls of tin foil  in a microwave.,long_filler,35518,heated up __ in a microwave,no,F,30
28,,cause_effect_prior,"""It&quotechars just fun to throw stuff in the water.""",Do you think Joshua is describing a normal event?,Tyler,object_high,M,15,marbles,sank,Tyler threw  15 marbles  into a pool.,long_filler,5015,threw __ into a pool,yes,M,31
28,,cause_effect_prior,"""Pretty normal.""",Do you think Michael is describing a normal event?,Janet,object_high,F,15,matches,burnt,Janet threw  15 matches  into a fire.,short_filler,3998,threw __ into a fire,yes,M,32
29,,cause_effect_prior,"""All of the logs broke.""",Do you think Helen is describing a normal event?,Steven,object_low,M,15,logs,broke,Steven ran  15 logs  over with a car.,All,8950,ran __ over with a car,no,F,3
29,,cause_effect_prior,"""Some of the eggs exploded.""",Do you think Anna is describing a normal event?,Jack,object_high,M,15,eggs,exploded,Jack heated up  15 eggs  in a microwave.,Some,3527,heated up __ in a microwave,no,F,4
29,,cause_effect_prior,"""None of the candles exploded.""",Do you think William is describing a normal event?,Samuel,object_low,M,15,candles,exploded,Samuel lit  15 candles.,None,5148,lit __,yes,M,5
29,,cause_effect_prior,"""Some of the bananas were green.""",Do you think Thomas is describing a normal event?,Tyler,object_mid,M,15,bananas,were green,Tyler saw  15 bananas.,Some,4284,saw __,yes,M,6
29,,cause_effect_prior,"""None of the new cars beeped.""",Do you think Diane is describing a normal event?,David,object_high,M,15,new cars,beeped,David left the lights on in  15 new cars.,None,2320,left the lights on in __,yes,F,7
29,seems pretty unlikely for all to run out of batteries,cause_effect_prior,"""All of the bike lights ran out of batteries.""",Do you think Stephanie is describing a normal event?,Kimberly,object_mid,F,15,bike lights,ran out of batteries,Kimberly left  15 bike lights  on (and unplugged) all day.,All,13622,left __ on (and unplugged) all day,no,F,8
29,,cause_effect_prior,"""It looks like a zebra.""",Do you think Robert is describing a normal event?,Brenda,object_high,F,15,stickers,stuck,Brenda glued  15 stickers  to a piece of paper.,long_filler,5655,glued __ to a piece of paper,yes,M,9
29,i didn&quotechart think dogs ate seeds,cause_effect_prior,"""Some of the dogs ate the seeds.""",Do you think Donna is describing a normal event?,Richard,object_low,M,15,dogs,ate the seeds,Richard left seeds out for  15 dogs.,Some,9559,left seeds out for __,no,F,10
29,sugar should be dissolving in water,cause_effect_prior,"""None of the sugar cubes dissolved.""",Do you think Angela is describing a normal event?,Julie,object_high,F,15,sugar cubes,dissolved,Julie put  15 sugar cubes  in a bucket of water.,None,10567,put __ in a bucket of water,no,F,11
29,,cause_effect_prior,"""What a strange thing to do.""",Do you think Alexander is describing a normal event?,Brandon,object_low,M,15,baseballs,stuck to the wall,Brandon threw  15 baseballs  against a wall.,long_filler,16001,threw __ against a wall,yes,M,12
29,,cause_effect_prior,"""Some people just love destruction.""",Do you think Carol is describing a normal event?,Shirley,object_high,F,15,card towers,fell down,Shirley punched  15 card towers.,long_filler,1938,punched __,yes,F,13
29,,cause_effect_prior,"""Typical.""",Do you think Melissa is describing a normal event?,Donald,object_low,M,15,poems,rhymed,Donald wrote  15 poems.,short_filler,1886,wrote __,yes,F,14
29,,cause_effect_prior,"""Some of the phones flashed.""",Do you think Karen is describing a normal event?,Nicholas,object_mid,M,15,phones,flashed,Nicholas took a picture with  15 phones.,Some,2000,took a picture with __,yes,F,15
29,ice cubes should melt in the sun,cause_effect_prior,"""None of the ice cubes melted.""",Do you think Emily is describing a normal event?,Benjamin,object_high,M,15,ice cubes,melted,Benjamin left  15 ice cubes  in the hot sun.,None,9071,left __ in the hot sun,no,F,16
29,,cause_effect_prior,"""Some of the taxi drivers honked.""",Do you think Dennis is describing a normal event?,Joseph,object_high,M,15,taxi drivers,honked,Joseph cut off  15 taxi drivers.,Some,3610,cut off __,yes,M,17
29,the tablecloths should be stained,cause_effect_prior,"""None of the white tablecloths got stained.""",Do you think Nicole is describing a normal event?,Lisa,object_low,F,15,white tablecloths,got stained,Lisa spilled red nail polish on  15 white tablecloths.,None,12949,spilled red nail polish on __,no,F,18
29,,cause_effect_prior,"""All of the kids laughed.""",Do you think Jacob is describing a normal event?,Raymond,object_high,M,15,kids,laughed,Raymond told a joke to  15 kids.,All,2726,told a joke to __,yes,M,19
29,,cause_effect_prior,"""Nothing surprising there.""",Do you think Virginia is describing a normal event?,Edward,object_low,M,15,bicycles,stopped,Edward pressed the brakes on  15 bicycles.,short_filler,2739,pressed the brakes on __,yes,F,20
29,,cause_effect_prior,"""Some of the shoes ripped.""",Do you think Jessica is describing a normal event?,Ashley,object_low,F,15,shoes,ripped,Ashley used  15 shoes  as dog toys.,Some,3236,used __ as dog toys,yes,F,21
29,,cause_effect_prior,"""All of the shopping carts rolled.""",Do you think Ronald is describing a normal event?,John,object_mid,M,15,shopping carts,rolled,John pushed  15 shopping carts.,All,2586,pushed __,yes,M,22
29,,cause_effect_prior,"""Some of the pinecones decomposed.""",Do you think Margaret is describing a normal event?,Rebecca,object_mid,F,15,pinecones,decomposed,Rebecca put  15 pinecones  in a compost pile for a month.,Some,1810,put __ in a compost pile for a month,yes,F,23
29,,cause_effect_prior,"""Some of the hats blew away.""",Do you think Michelle is describing a normal event?,Janet,object_mid,F,15,hats,blew away,Janet left  15 hats  on a table on a windy day.,Some,2155,left __ on a table on a windy day,yes,F,24
29,,cause_effect_prior,"""That reminds me I need to visit my grandma.""",Do you think Jason is describing a normal event?,Dorothy,object_high,F,15,berries,froze,Dorothy put  15 berries  in the freezer.,long_filler,6226,put __ in the freezer,yes,M,25
29,i don&quotechart understand why he would placed them in the sun,cause_effect_prior,"""Nothing out of the ordinary.""",Do you think Deborah is describing a normal event?,Timothy,object_low,M,15,phone screens,reflected the sunlight,Timothy placed  15 phone screens  in the sun.,short_filler,16395,placed __ in the sun,no,F,26
29,,cause_effect_prior,"""It&quotechars just fun to throw stuff in the water.""",Do you think Gregory is describing a normal event?,Sandra,object_mid,F,15,cups,sank,Sandra threw  15 cups  into a pool.,long_filler,5503,threw __ into a pool,yes,M,27
29,,cause_effect_prior,"""As usual.""",Do you think Justin is describing a normal event?,Amanda,object_high,F,15,flashlights,lit up,Amanda pressed the &quotecharon&quotechar button on  15 flashlights.,short_filler,2524,pressed the &quotecharon&quotechar button on __,yes,M,28
29,,cause_effect_prior,"""All of the coins landed flat.""",Do you think Mark is describing a normal event?,Elizabeth,object_high,F,15,coins,landed flat,Elizabeth tossed  15 coins.,All,12099,tossed __,yes,M,29
29,,cause_effect_prior,"""Some of the rocks burnt.""",Do you think Samantha is describing a normal event?,Sharon,object_low,F,15,rocks,burnt,Sharon threw  15 rocks  into a fire.,Some,4104,threw __ into a fire,yes,F,30
29,,cause_effect_prior,"""Some of the birthday cards had the letter Z in them.""",Do you think Frank is describing a normal event?,Emily,object_low,F,15,birthday cards,had the letter Z in them,Emily wrote  15 birthday cards.,Some,3281,wrote __,yes,M,31
29,,cause_effect_prior,"""Pretty normal.""",Do you think Kenneth is describing a normal event?,Amy,object_mid,F,15,balloons,popped,Amy poked  15 balloons  with a pin.,short_filler,3624,poked __ with a pin,yes,M,32
30,,cause_effect_prior,"""None of the pencils melted.""",Do you think Michelle is describing a normal event?,Joyce,object_low,F,15,pencils,melted,Joyce left  15 pencils  in the hot sun.,None,572069,left __ in the hot sun,yes,F,3
30,,cause_effect_prior,"""Some of the bubbles popped.""",Do you think John is describing a normal event?,Emily,object_high,F,15,bubbles,popped,Emily poked  15 bubbles  with a pin.,Some,4754,poked __ with a pin,yes,M,4
30,,cause_effect_prior,"""Why not just take them inside?""",Do you think Brian is describing a normal event?,Mary,object_low,F,15,phone screens,reflected the sunlight,Mary placed  15 phone screens  in the sun.,long_filler,7907,placed __ in the sun,yes,M,5
30,,cause_effect_prior,"""Nothing out of the ordinary.""",Do you think Mark is describing a normal event?,Christina,object_low,F,15,bicyclists,honked,Christina cut off  15 bicyclists.,short_filler,2764,cut off __,yes,M,6
30,,cause_effect_prior,"""Some of the webcams flashed.""",Do you think Gregory is describing a normal event?,Amanda,object_low,F,15,webcams,flashed,Amanda took a picture with  15 webcams.,Some,2436,took a picture with __,yes,M,7
30,you would expect all or almost all to blow away,cause_effect_prior,"""Some of the hats blew away.""",Do you think Emily is describing a normal event?,Joseph,object_mid,M,15,hats,blew away,Joseph left  15 hats  on a table on a windy day.,Some,12476,left __ on a table on a windy day,no,F,8
30,,cause_effect_prior,"""Typical.""",Do you think David is describing a normal event?,Melissa,object_low,F,15,beads,stuck,Melissa glued  15 beads  to a piece of paper.,short_filler,3965,glued __ to a piece of paper,yes,M,9
30,you would expect all of the books to burn,cause_effect_prior,"""Some of the books burnt.""",Do you think Alexander is describing a normal event?,Anna,object_mid,F,15,books,burnt,Anna threw  15 books  into a fire.,Some,14649,threw __ into a fire,no,M,10
30,,cause_effect_prior,"""All of the phones ran out of batteries.""",Do you think William is describing a normal event?,Helen,object_low,F,15,phones,ran out of batteries,Helen left  15 phones  on (and unplugged) all day.,All,3555,left __ on (and unplugged) all day,yes,M,11
30,you would expect all of the wheelchairs to roll,cause_effect_prior,"""Some of the wheelchairs rolled.""",Do you think Karen is describing a normal event?,Stephanie,object_high,F,15,wheelchairs,rolled,Stephanie pushed  15 wheelchairs.,Some,7789,pushed __,no,F,12
30,,cause_effect_prior,"""None of the limericks rhymed.""",Do you think Michael is describing a normal event?,Susan,object_high,F,15,limericks,rhymed,Susan wrote  15 limericks.,None,2596,wrote __,yes,M,13
30,you would expect all of the shirts to stain,cause_effect_prior,"""Some of the white shirts got stained.""",Do you think Benjamin is describing a normal event?,Patrick,object_mid,M,15,white shirts,got stained,Patrick spilled red nail polish on  15 white shirts.,Some,7216,spilled red nail polish on __,no,M,14
30,houses don&quotechart beep,cause_effect_prior,"""All of the houses beeped.""",Do you think Andrew is describing a normal event?,Edward,object_low,M,15,houses,beeped,Edward left the lights on in  15 houses.,All,10454,left the lights on in __,no,M,15
30,,cause_effect_prior,"""Some of the pieces of gum stuck to the wall.""",Do you think James is describing a normal event?,Kenneth,object_high,M,15,pieces of gum,stuck to the wall,Kenneth threw  15 pieces of gum  against a wall.,Some,2778,threw __ against a wall,yes,M,16
30,you would expect at least some of the bars to freeze,cause_effect_prior,"""None of the chocolate bars froze.""",Do you think Kimberly is describing a normal event?,Donald,object_mid,M,15,chocolate bars,froze,Donald put  15 chocolate bars  in the freezer.,None,9320,put __ in the freezer,no,F,17
30,you wouldn&quotechart expect that many zs,cause_effect_prior,"""All of the birthday cards had the letter Z in them.""",Do you think Heather is describing a normal event?,Charles,object_low,M,15,birthday cards,had the letter Z in them,Charles wrote  15 birthday cards.,All,8107,wrote __,no,F,18
30,,cause_effect_prior,"""That&quotechars one way of spending your free time.""",Do you think Jack is describing a normal event?,Rachel,object_low,F,15,CDs,exploded,Rachel heated up  15 CDs  in a microwave.,long_filler,3542,heated up __ in a microwave,yes,M,19
30,,cause_effect_prior,"""So many parts need to work for us to not die.""",Do you think Ruth is describing a normal event?,Catherine,object_low,F,15,bicycles,stopped,Catherine pressed the brakes on  15 bicycles.,long_filler,3253,pressed the brakes on __,yes,F,20
30,,cause_effect_prior,"""Some of the birds ate the seeds.""",Do you think Sarah is describing a normal event?,Samuel,object_high,M,15,birds,ate the seeds,Samuel left seeds out for  15 birds.,Some,2093,left seeds out for __,yes,F,21
30,,cause_effect_prior,"""Why does Lucy always leave her stuff in the driveway?""",Do you think Angela is describing a normal event?,Thomas,object_high,M,15,sunglasses,broke,Thomas ran  15 sunglasses  over with a car.,long_filler,3067,ran __ over with a car,yes,F,22
30,you would expect all of the marbles to sink,cause_effect_prior,"""Some of the marbles sank.""",Do you think Elizabeth is describing a normal event?,Joshua,object_high,M,15,marbles,sank,Joshua threw  15 marbles  into a pool.,Some,4717,threw __ into a pool,no,F,23
30,you would expect at least some of the pinecones to decompose,cause_effect_prior,"""None of the pinecones decomposed.""",Do you think Jacob is describing a normal event?,Daniel,object_mid,M,15,pinecones,decomposed,Daniel put  15 pinecones  in a compost pile for a month.,None,10545,put __ in a compost pile for a month,no,M,24
30,you would expect at least some of the oreos to dissolve,cause_effect_prior,"""None of the oreos dissolved.""",Do you think Julie is describing a normal event?,Ryan,object_mid,M,15,oreos,dissolved,Ryan put  15 oreos  in a bucket of water.,None,9838,put __ in a bucket of water,no,F,25
30,,cause_effect_prior,"""All of the books ripped.""",Do you think Cynthia is describing a normal event?,Virginia,object_high,F,15,books,ripped,Virginia used  15 books  as dog toys.,All,2150,used __ as dog toys,yes,F,26
30,,cause_effect_prior,"""Some of the notebooks landed flat.""",Do you think Diane is describing a normal event?,Jonathan,object_low,M,15,notebooks,landed flat,Jonathan tossed  15 notebooks.,Some,6511,tossed __,yes,F,27
30,,cause_effect_prior,"""Pretty normal.""",Do you think Amy is describing a normal event?,Christopher,object_high,M,15,gas tanks,exploded,Christopher lit  15 gas tanks.,short_filler,4363,lit __,yes,F,28
