workerid,strangedescription,trial_type,actual_utterance,actual_effect_question,name,object_level,gender,num_objects,object,effect,actual_cause,quantifier,rt,cause,response,other_gender,slide_number_in_experiment
44,All fire works explode,cause_effect_prior,"""None of the fireworks exploded.""",Do you think Brenda is describing a normal event?,Edward,object_mid,M,15,fireworks,exploded,Edward lit  15 fireworks.,None,30994,lit __,no,F,20
44,,cause_effect_prior,"""Some of the old cars beeped.""",Do you think Nancy is describing a normal event?,Deborah,object_mid,F,15,old cars,beeped,Deborah left the lights on in  15 old cars.,Some,13684,left the lights on in __,yes,F,21
44,,cause_effect_prior,"""All of the phone screens reflected the sunlight.""",Do you think Shirley is describing a normal event?,Charles,object_low,M,15,phone screens,reflected the sunlight,Charles placed  15 phone screens  in the sun.,All,11903,placed __ in the sun,yes,F,22
44,Atleast a light would come on,cause_effect_prior,"""None of the computers lit up.""",Do you think Emma is describing a normal event?,Samantha,object_mid,F,15,computers,lit up,Samantha pressed the &quotecharon&quotechar button on  15 computers.,None,30057,pressed the &quotecharon&quotechar button on __,no,F,23
44,,cause_effect_prior,"""I guess once a jokester, always a jokester.""",Do you think Samuel is describing a normal event?,Kathleen,object_low,F,15,lawyers,laughed,Kathleen told a joke to  15 lawyers.,long_filler,8863,told a joke to __,yes,M,24
44,They all would break,cause_effect_prior,"""Some of the sunglasses broke.""",Do you think Ashley is describing a normal event?,Brian,object_high,M,15,sunglasses,broke,Brian ran  15 sunglasses  over with a car.,Some,17116,ran __ over with a car,no,F,25
44,,cause_effect_prior,"""I should start growing those myself.""",Do you think Emily is describing a normal event?,Christina,object_high,F,15,clovers,were green,Christina saw  15 clovers.,long_filler,18898,saw __,yes,F,26
44,They take much longer then a month,cause_effect_prior,"""Some of the pinecones decomposed.""",Do you think Elizabeth is describing a normal event?,Kenneth,object_mid,M,15,pinecones,decomposed,Kenneth put  15 pinecones  in a compost pile for a month.,Some,25378,put __ in a compost pile for a month,no,F,27
44,That the wheelchairs didn&quotechart roll along ,cause_effect_prior,"""None of the wheelchairs rolled.""",Do you think Kevin is describing a normal event?,Anna,object_high,F,15,wheelchairs,rolled,Anna pushed  15 wheelchairs.,None,34764,pushed __,no,M,28
44,,cause_effect_prior,"""Some of the cups sank.""",Do you think Catherine is describing a normal event?,William,object_mid,M,15,cups,sank,William threw  15 cups  into a pool.,Some,14475,threw __ into a pool,yes,F,29
44,,cause_effect_prior,"""I love watching fires.""",Do you think Christopher is describing a normal event?,Janet,object_high,F,15,matches,burnt,Janet threw  15 matches  into a fire.,long_filler,7841,threw __ into a fire,yes,M,30
44,,cause_effect_prior,"""Some of the chocolate bars froze.""",Do you think Jessica is describing a normal event?,Matthew,object_mid,M,15,chocolate bars,froze,Matthew put  15 chocolate bars  in the freezer.,Some,6986,put __ in the freezer,yes,F,31
44,,cause_effect_prior,"""All of the sugar cubes dissolved.""",Do you think Andrew is describing a normal event?,Jeffrey,object_high,M,15,sugar cubes,dissolved,Jeffrey put  15 sugar cubes  in a bucket of water.,All,9528,put __ in a bucket of water,yes,M,32
45,Using 15 books as dog toys.,cause_effect_prior,"""Typical.""",Do you think Anna is describing a normal event?,Nicholas,object_high,M,15,books,ripped,Nicholas used  15 books  as dog toys.,short_filler,204905,used __ as dog toys,no,F,3
45,,cause_effect_prior,"""All of the books burnt.""",Do you think Cynthia is describing a normal event?,Janet,object_mid,F,15,books,burnt,Janet threw  15 books  into a fire.,All,4534,threw __ into a fire,yes,F,4
45,Nobody uses 15 phones.,cause_effect_prior,"""Everyone with the selfie craze these days.""",Do you think Robert is describing a normal event?,Alexander,object_mid,M,15,phones,flashed,Alexander took a picture with  15 phones.,long_filler,15374,took a picture with __,no,M,5
45,,cause_effect_prior,"""Some of the toy cars rolled.""",Do you think Dorothy is describing a normal event?,Mary,object_low,F,15,toy cars,rolled,Mary pushed  15 toy cars.,Some,3615,pushed __,yes,F,6
45,The lights do not effect the environment,cause_effect_prior,"""That&quotechars not very good for the environment.""",Do you think Benjamin is describing a normal event?,Diane,object_mid,F,15,old cars,beeped,Diane left the lights on in  15 old cars.,long_filler,20320,left the lights on in __,no,M,7
45,The boxes would break,cause_effect_prior,"""None of the boxes broke.""",Do you think Kevin is describing a normal event?,Linda,object_mid,F,15,boxes,broke,Linda ran  15 boxes  over with a car.,None,14875,ran __ over with a car,no,M,8
45,,cause_effect_prior,"""I just don&quotechart have the patience to write one of those.""",Do you think John is describing a normal event?,Tyler,object_mid,M,15,love notes,had the letter Z in them,Tyler wrote  15 love notes.,long_filler,4842,wrote __,yes,M,9
45,,cause_effect_prior,"""Some of the bubbles popped.""",Do you think Frank is describing a normal event?,Richard,object_high,M,15,bubbles,popped,Richard poked  15 bubbles  with a pin.,Some,3999,poked __ with a pin,yes,M,10
45,,cause_effect_prior,"""So many parts need to work for us to not die.""",Do you think Elizabeth is describing a normal event?,Michelle,object_mid,F,15,motorcycles,stopped,Michelle pressed the brakes on  15 motorcycles.,long_filler,59946,pressed the brakes on __,yes,F,11
45,,cause_effect_prior,"""Some of the taxi drivers honked.""",Do you think Jerry is describing a normal event?,Stephanie,object_high,F,15,taxi drivers,honked,Stephanie cut off  15 taxi drivers.,Some,3604,cut off __,yes,M,12
45,,cause_effect_prior,"""All of the berries froze.""",Do you think Ashley is describing a normal event?,Kathleen,object_high,F,15,berries,froze,Kathleen put  15 berries  in the freezer.,All,6041,put __ in the freezer,yes,F,13
45,,cause_effect_prior,"""Some of the ice cubes melted.""",Do you think Jacob is describing a normal event?,Jennifer,object_high,F,15,ice cubes,melted,Jennifer left  15 ice cubes  in the hot sun.,Some,3898,left __ in the hot sun,yes,M,14
45,,cause_effect_prior,"""Pretty normal.""",Do you think Helen is describing a normal event?,Jeffrey,object_high,M,15,limericks,rhymed,Jeffrey wrote  15 limericks.,short_filler,4859,wrote __,yes,F,15
45,Lighting 15 gas tanks is not normal,cause_effect_prior,"""Nothing surprising there.""",Do you think Emma is describing a normal event?,Jason,object_high,M,15,gas tanks,exploded,Jason lit  15 gas tanks.,short_filler,28706,lit __,no,F,16
45,,cause_effect_prior,"""Some of the stickers stuck.""",Do you think Joshua is describing a normal event?,Joyce,object_high,F,15,stickers,stuck,Joyce glued  15 stickers  to a piece of paper.,Some,3257,glued __ to a piece of paper,yes,M,17
45,,cause_effect_prior,"""All of the eggs exploded.""",Do you think Margaret is describing a normal event?,Scott,object_high,M,15,eggs,exploded,Scott heated up  15 eggs  in a microwave.,All,2739,heated up __ in a microwave,yes,F,18
45,,cause_effect_prior,"""Some of the notebooks landed flat.""",Do you think Eric is describing a normal event?,Susan,object_low,F,15,notebooks,landed flat,Susan tossed  15 notebooks.,Some,5425,tossed __,yes,M,19
45,,cause_effect_prior,"""Nothing out of the ordinary.""",Do you think Sharon is describing a normal event?,Thomas,object_low,M,15,backpacks,blew away,Thomas left  15 backpacks  on a table on a windy day.,short_filler,7563,left __ on a table on a windy day,yes,F,20
45,They would fall down.,cause_effect_prior,"""None of the card towers fell down.""",Do you think Donna is describing a normal event?,James,object_high,M,15,card towers,fell down,James punched  15 card towers.,None,9302,punched __,no,F,21
45,They would have to be plugged in,cause_effect_prior,"""As usual.""",Do you think Samantha is describing a normal event?,Laura,object_mid,F,15,bike lights,ran out of batteries,Laura left  15 bike lights  on (and unplugged) all day.,short_filler,14770,left __ on (and unplugged) all day,no,F,22
45,,cause_effect_prior,"""All of the comedians laughed.""",Do you think Larry is describing a normal event?,Timothy,object_mid,M,15,comedians,laughed,Timothy told a joke to  15 comedians.,All,40083,told a joke to __,yes,M,23
45,,cause_effect_prior,"""Some of the pieces of gum stuck to the wall.""",Do you think Kenneth is describing a normal event?,Edward,object_high,M,15,pieces of gum,stuck to the wall,Edward threw  15 pieces of gum  against a wall.,Some,2967,threw __ against a wall,yes,M,24
45,,cause_effect_prior,"""Some of the sugar cubes dissolved.""",Do you think Catherine is describing a normal event?,Mark,object_high,M,15,sugar cubes,dissolved,Mark put  15 sugar cubes  in a bucket of water.,Some,3750,put __ in a bucket of water,yes,F,25
45,Some would light up,cause_effect_prior,"""None of the flashlights lit up.""",Do you think William is describing a normal event?,Joseph,object_high,M,15,flashlights,lit up,Joseph pressed the &quotecharon&quotechar button on  15 flashlights.,None,11154,pressed the &quotecharon&quotechar button on __,no,M,26
45,Balloons do not sink.,cause_effect_prior,"""Some of the balloons sank.""",Do you think Donald is describing a normal event?,Sarah,object_low,F,15,balloons,sank,Sarah threw  15 balloons  into a pool.,Some,13543,threw __ into a pool,no,M,27
45,,cause_effect_prior,"""Some of the clovers were green.""",Do you think Carol is describing a normal event?,Shirley,object_high,F,15,clovers,were green,Shirley saw  15 clovers.,Some,2684,saw __,yes,F,28
45,All of the mirrors would reflect sunlight,cause_effect_prior,"""None of the mirrors reflected the sunlight.""",Do you think Steven is describing a normal event?,Ryan,object_high,M,15,mirrors,reflected the sunlight,Ryan placed  15 mirrors  in the sun.,None,12129,placed __ in the sun,no,M,29
45,,cause_effect_prior,"""All of the soda cans decomposed.""",Do you think Raymond is describing a normal event?,Gary,object_low,M,15,soda cans,decomposed,Gary put  15 soda cans  in a compost pile for a month.,All,5432,put __ in a compost pile for a month,yes,M,30
45,Birds would eat the seeds,cause_effect_prior,"""None of the birds ate the seeds.""",Do you think Christopher is describing a normal event?,David,object_high,M,15,birds,ate the seeds,David left seeds out for  15 birds.,None,9574,left seeds out for __,no,M,31
45,,cause_effect_prior,"""Why always the red?""",Do you think Andrew is describing a normal event?,Daniel,object_low,M,15,white tablecloths,got stained,Daniel spilled red nail polish on  15 white tablecloths.,long_filler,5189,spilled red nail polish on __,yes,M,32
46,,cause_effect_prior,"""Some people just love destruction.""",Do you think Robert is describing a normal event?,Gary,object_low,M,15,shelves,fell down,Gary punched  15 shelves.,long_filler,41222,punched __,yes,M,3
46,,cause_effect_prior,"""Some of the cd-players lit up.""",Do you think Heather is describing a normal event?,Ryan,object_low,M,15,cd-players,lit up,Ryan pressed the &quotecharon&quotechar button on  15 cd-players.,Some,9729,pressed the &quotecharon&quotechar button on __,yes,F,4
46,,cause_effect_prior,"""Some of the shoes ripped.""",Do you think Anthony is describing a normal event?,Mary,object_low,F,15,shoes,ripped,Mary used  15 shoes  as dog toys.,Some,8172,used __ as dog toys,yes,M,5
46,,cause_effect_prior,"""Pretty normal.""",Do you think Sarah is describing a normal event?,Karen,object_low,F,15,strawberries,were green,Karen saw  15 strawberries.,short_filler,12623,saw __,yes,F,6
46,"Baseballs usually fall to the ground, they do not stick to walls often.",cause_effect_prior,"""Some of the baseballs stuck to the wall.""",Do you think Stephanie is describing a normal event?,Joyce,object_low,F,15,baseballs,stuck to the wall,Joyce threw  15 baseballs  against a wall.,Some,23032,threw __ against a wall,no,F,7
46,"People normally push 1 cart around.  15 carts is a tremendous number, even for the grocery shop worker who transports the carts.",cause_effect_prior,"""Nothing surprising there.""",Do you think Ashley is describing a normal event?,Emily,object_mid,F,15,shopping carts,rolled,Emily pushed  15 shopping carts.,short_filler,40678,pushed __,no,F,8
46,Usually all of the cups should float.,cause_effect_prior,"""Some of the cups sank.""",Do you think Paul is describing a normal event?,Samantha,object_mid,F,15,cups,sank,Samantha threw  15 cups  into a pool.,Some,16334,threw __ into a pool,no,M,9
46,,cause_effect_prior,"""All of the soda cans decomposed.""",Do you think Christopher is describing a normal event?,Rebecca,object_low,F,15,soda cans,decomposed,Rebecca put  15 soda cans  in a compost pile for a month.,All,8077,put __ in a compost pile for a month,yes,M,10
46,,cause_effect_prior,"""Some of the laptops ran out of batteries.""",Do you think Ruth is describing a normal event?,Larry,object_high,M,15,laptops,ran out of batteries,Larry left  15 laptops  on (and unplugged) all day.,Some,6926,left __ on (and unplugged) all day,yes,F,11
46,,cause_effect_prior,"""None of the berries froze.""",Do you think Richard is describing a normal event?,Nicholas,object_high,M,15,berries,froze,Nicholas put  15 berries  in the freezer.,None,15375,put __ in the freezer,yes,M,12
46,"Nicole is probably a human, she does not eat from &quotecharsomeone&quotechar leaving seeds out for her.",cause_effect_prior,"""I wish someone would leave seeds out for me.""",Do you think Nicole is describing a normal event?,Jerry,object_low,M,15,dogs,ate the seeds,Jerry left seeds out for  15 dogs.,long_filler,26238,left seeds out for __,no,F,13
46,,cause_effect_prior,"""None of the cameras flashed.""",Do you think Margaret is describing a normal event?,William,object_high,M,15,cameras,flashed,William took a picture with  15 cameras.,None,6807,took a picture with __,yes,F,14
46,,cause_effect_prior,"""Some of the limericks rhymed.""",Do you think Kevin is describing a normal event?,Alexander,object_high,M,15,limericks,rhymed,Alexander wrote  15 limericks.,Some,5605,wrote __,yes,M,15
46,,cause_effect_prior,"""All of the napkins blew away.""",Do you think Carolyn is describing a normal event?,Amy,object_high,F,15,napkins,blew away,Amy left  15 napkins  on a table on a windy day.,All,6605,left __ on a table on a windy day,yes,F,16
46,,cause_effect_prior,"""That requires a lot of concentration.""",Do you think Jack is describing a normal event?,Dorothy,object_mid,F,15,balloons,popped,Dorothy poked  15 balloons  with a pin.,long_filler,7792,poked __ with a pin,yes,M,17
46,,cause_effect_prior,"""Some of the new cars beeped.""",Do you think Andrew is describing a normal event?,Elizabeth,object_high,F,15,new cars,beeped,Elizabeth left the lights on in  15 new cars.,Some,7327,left the lights on in __,yes,M,18
46,Throwing rocks into a fire is not a normal event.  It is not typical or ordinary. ,cause_effect_prior,"""As usual.""",Do you think Raymond is describing a normal event?,Joseph,object_low,M,15,rocks,burnt,Joseph threw  15 rocks  into a fire.,short_filler,24198,threw __ into a fire,no,M,19
46,Each of those balls would explode until the microwave is destroyed.,cause_effect_prior,"""None of the balls of tin foil exploded.""",Do you think James is describing a normal event?,Ronald,object_mid,M,15,balls of tin foil,exploded,Ronald heated up  15 balls of tin foil  in a microwave.,None,22797,heated up __ in a microwave,no,M,20
46,,cause_effect_prior,"""None of the comedians laughed.""",Do you think Jeffrey is describing a normal event?,Christina,object_mid,F,15,comedians,laughed,Christina told a joke to  15 comedians.,None,25317,told a joke to __,yes,M,21
46,,cause_effect_prior,"""All of the cars stopped.""",Do you think John is describing a normal event?,Matthew,object_high,M,15,cars,stopped,Matthew pressed the brakes on  15 cars.,All,4327,pressed the brakes on __,yes,M,22
46,,cause_effect_prior,"""Some of the pencils melted.""",Do you think Catherine is describing a normal event?,Melissa,object_low,F,15,pencils,melted,Melissa left  15 pencils  in the hot sun.,Some,5159,left __ in the hot sun,yes,F,23
46,Some taxi drivers are passive in that they would not honk even at being cut off.,cause_effect_prior,"""All of the taxi drivers honked.""",Do you think Jennifer is describing a normal event?,Nancy,object_high,F,15,taxi drivers,honked,Nancy cut off  15 taxi drivers.,All,21415,cut off __,no,F,24
46,It is probably extremely hard and damaging to your car to run over a log.,cause_effect_prior,"""Typical.""",Do you think Deborah is describing a normal event?,Kenneth,object_low,M,15,logs,broke,Kenneth ran  15 logs  over with a car.,short_filler,25478,ran __ over with a car,no,F,25
46,,cause_effect_prior,"""Some of the white shirts got stained.""",Do you think Thomas is describing a normal event?,Timothy,object_mid,M,15,white shirts,got stained,Timothy spilled red nail polish on  15 white shirts.,Some,10326,spilled red nail polish on __,yes,M,26
46,All of the coins should lay flat,cause_effect_prior,"""Some of the coins landed flat.""",Do you think Frank is describing a normal event?,Kimberly,object_high,F,15,coins,landed flat,Kimberly tossed  15 coins.,Some,12152,tossed __,no,M,27
46,,cause_effect_prior,"""Who came up with that idea?""",Do you think Gregory is describing a normal event?,Brandon,object_high,M,15,gas tanks,exploded,Brandon lit  15 gas tanks.,long_filler,6262,lit __,yes,M,28
46,All of the oreos should dissolve in water.,cause_effect_prior,"""None of the oreos dissolved.""",Do you think Mark is describing a normal event?,Susan,object_mid,F,15,oreos,dissolved,Susan put  15 oreos  in a bucket of water.,None,14940,put __ in a bucket of water,no,M,29
46,,cause_effect_prior,"""All of the diamonds reflected the sunlight.""",Do you think Sharon is describing a normal event?,David,object_mid,M,15,diamonds,reflected the sunlight,David placed  15 diamonds  in the sun.,All,5641,placed __ in the sun,yes,F,30
46,,cause_effect_prior,"""I just don&quotechart have the patience to write one of those.""",Do you think Jason is describing a normal event?,Jonathan,object_high,M,15,novels,had the letter Z in them,Jonathan wrote  15 novels.,long_filler,4815,wrote __,yes,M,31
46,,cause_effect_prior,"""Nothing out of the ordinary.""",Do you think Linda is describing a normal event?,Diane,object_mid,F,15,sequins,stuck,Diane glued  15 sequins  to a piece of paper.,short_filler,9045,glued __ to a piece of paper,yes,F,32
47,rocks burning,cause_effect_prior,"""None of the rocks burnt.""",Do you think Julie is describing a normal event?,Brandon,object_low,M,15,rocks,burnt,Brandon threw  15 rocks  into a fire.,None,11042,threw __ into a fire,no,F,3
47,danger,cause_effect_prior,"""Some of the gas tanks exploded.""",Do you think Karen is describing a normal event?,Ryan,object_high,M,15,gas tanks,exploded,Ryan lit  15 gas tanks.,Some,6724,lit __,no,F,4
47,,cause_effect_prior,"""I just don&quotechart have the patience to write one of those.""",Do you think Ashley is describing a normal event?,Jacob,object_mid,M,15,love notes,had the letter Z in them,Jacob wrote  15 love notes.,long_filler,4026,wrote __,yes,F,5
47,houses don&quotechart beep,cause_effect_prior,"""None of the houses beeped.""",Do you think Amanda is describing a normal event?,Alexander,object_low,M,15,houses,beeped,Alexander left the lights on in  15 houses.,None,110588,left the lights on in __,no,F,6
47,,cause_effect_prior,"""Some of the bubbles popped.""",Do you think Donald is describing a normal event?,Joshua,object_high,M,15,bubbles,popped,Joshua poked  15 bubbles  with a pin.,Some,2242,poked __ with a pin,yes,M,7
47,,cause_effect_prior,"""All of the white carpets got stained.""",Do you think Emily is describing a normal event?,Richard,object_high,M,15,white carpets,got stained,Richard spilled red nail polish on  15 white carpets.,All,2648,spilled red nail polish on __,yes,F,8
47,,cause_effect_prior,"""Typical.""",Do you think Dorothy is describing a normal event?,Shirley,object_mid,F,15,shirts,ripped,Shirley used  15 shirts  as dog toys.,short_filler,2034,used __ as dog toys,yes,F,9
47,,cause_effect_prior,"""Some of the phones flashed.""",Do you think Laura is describing a normal event?,Catherine,object_mid,F,15,phones,flashed,Catherine took a picture with  15 phones.,Some,2338,took a picture with __,yes,F,10
47,,cause_effect_prior,"""It looks like a zebra.""",Do you think Linda is describing a normal event?,Thomas,object_high,M,15,stickers,stuck,Thomas glued  15 stickers  to a piece of paper.,long_filler,1891,glued __ to a piece of paper,yes,F,11
47,,cause_effect_prior,"""Some of the pancakes landed flat.""",Do you think Nancy is describing a normal event?,Kathleen,object_mid,F,15,pancakes,landed flat,Kathleen tossed  15 pancakes.,Some,2284,tossed __,yes,F,12
47,,cause_effect_prior,"""Some of the dogs ate the seeds.""",Do you think Mary is describing a normal event?,Deborah,object_low,F,15,dogs,ate the seeds,Deborah left seeds out for  15 dogs.,Some,3741,left seeds out for __,yes,F,13
47,,cause_effect_prior,"""Some of the laptops ran out of batteries.""",Do you think Samantha is describing a normal event?,David,object_high,M,15,laptops,ran out of batteries,David left  15 laptops  on (and unplugged) all day.,Some,2016,left __ on (and unplugged) all day,yes,F,14
47,ballons usually dont sink,cause_effect_prior,"""All of the balloons sank.""",Do you think Raymond is describing a normal event?,Amy,object_low,F,15,balloons,sank,Amy threw  15 balloons  into a pool.,All,9381,threw __ into a pool,no,M,15
47,,cause_effect_prior,"""Some of the phone screens reflected the sunlight.""",Do you think Ruth is describing a normal event?,Jason,object_low,M,15,phone screens,reflected the sunlight,Jason placed  15 phone screens  in the sun.,Some,3108,placed __ in the sun,yes,F,16
47,,cause_effect_prior,"""There are people starving in the world.""",Do you think Daniel is describing a normal event?,Larry,object_mid,M,15,oreos,dissolved,Larry put  15 oreos  in a bucket of water.,long_filler,1816,put __ in a bucket of water,yes,M,17
47,,cause_effect_prior,"""As usual.""",Do you think Stephanie is describing a normal event?,Eric,object_low,M,15,bicycles,stopped,Eric pressed the brakes on  15 bicycles.,short_filler,1635,pressed the brakes on __,yes,F,18
47,,cause_effect_prior,"""That reminds me I need to visit my grandma.""",Do you think Gregory is describing a normal event?,Anna,object_high,F,15,berries,froze,Anna put  15 berries  in the freezer.,long_filler,3125,put __ in the freezer,yes,M,19
47,,cause_effect_prior,"""I should start growing those myself.""",Do you think Kenneth is describing a normal event?,Christopher,object_mid,M,15,bananas,were green,Christopher saw  15 bananas.,long_filler,2530,saw __,yes,M,20
47,,cause_effect_prior,"""All of the kids laughed.""",Do you think Betty is describing a normal event?,Helen,object_high,F,15,kids,laughed,Helen told a joke to  15 kids.,All,1496,told a joke to __,yes,F,21
47,,cause_effect_prior,"""Some of the pieces of gum stuck to the wall.""",Do you think Robert is describing a normal event?,Tyler,object_high,M,15,pieces of gum,stuck to the wall,Tyler threw  15 pieces of gum  against a wall.,Some,2145,threw __ against a wall,yes,M,22
47,"balls of tin foil usually don&quotechart explode
",cause_effect_prior,"""Some of the balls of tin foil exploded.""",Do you think William is describing a normal event?,Jennifer,object_mid,F,15,balls of tin foil,exploded,Jennifer heated up  15 balls of tin foil  in a microwave.,Some,16188,heated up __ in a microwave,no,M,23
47,,cause_effect_prior,"""Some of the toy cars rolled.""",Do you think Charles is describing a normal event?,Donna,object_low,F,15,toy cars,rolled,Donna pushed  15 toy cars.,Some,2839,pushed __,yes,M,24
47,,cause_effect_prior,"""Nothing surprising there.""",Do you think Sarah is describing a normal event?,Justin,object_high,M,15,taxi drivers,honked,Justin cut off  15 taxi drivers.,short_filler,1655,cut off __,yes,F,25
47,,cause_effect_prior,"""Nothing out of the ordinary.""",Do you think Emma is describing a normal event?,Benjamin,object_low,M,15,cd-players,lit up,Benjamin pressed the &quotecharon&quotechar button on  15 cd-players.,short_filler,1544,pressed the &quotecharon&quotechar button on __,yes,F,26
47,poems usually rhyme,cause_effect_prior,"""None of the poems rhymed.""",Do you think Jack is describing a normal event?,Nicole,object_low,F,15,poems,rhymed,Nicole wrote  15 poems.,None,8632,wrote __,no,M,27
47,,cause_effect_prior,"""None of the napkins blew away.""",Do you think Edward is describing a normal event?,Rachel,object_high,F,15,napkins,blew away,Rachel left  15 napkins  on a table on a windy day.,None,3427,left __ on a table on a windy day,yes,M,28
47,,cause_effect_prior,"""All of the card towers fell down.""",Do you think Virginia is describing a normal event?,Ronald,object_high,M,15,card towers,fell down,Ronald punched  15 card towers.,All,1881,punched __,yes,F,29
47,soda cans usually don&quotechart decompose,cause_effect_prior,"""All of the soda cans decomposed.""",Do you think Samuel is describing a normal event?,Melissa,object_low,F,15,soda cans,decomposed,Melissa put  15 soda cans  in a compost pile for a month.,All,8482,put __ in a compost pile for a month,no,M,30
47,,cause_effect_prior,"""Pretty normal.""",Do you think Michelle is describing a normal event?,Kevin,object_low,M,15,pencils,melted,Kevin left  15 pencils  in the hot sun.,short_filler,1719,left __ in the hot sun,yes,F,31
