workerid,strangedescription,trial_type,actual_utterance,actual_effect_question,name,object_level,gender,num_objects,object,effect,actual_cause,quantifier,rt,cause,response,other_gender,slide_number_in_experiment
13,,cause_effect_prior,"""Some of the shelves fell down.""",Do you think Samuel is describing a normal event?,Joyce,object_low,F,15,shelves,fell down,Joyce punched  15 shelves.,Some,4492,punched __,yes,M,29
13,Having 15 phones is not normal,cause_effect_prior,"""Nothing out of the ordinary.""",Do you think Larry is describing a normal event?,Benjamin,object_mid,M,15,phones,flashed,Benjamin took a picture with  15 phones.,short_filler,11941,took a picture with __,no,M,30
13,There is no reason to throw the gum against the wall,cause_effect_prior,"""What a strange thing to do.""",Do you think Alexander is describing a normal event?,Andrew,object_high,M,15,pieces of gum,stuck to the wall,Andrew threw  15 pieces of gum  against a wall.,long_filler,16362,threw __ against a wall,no,M,31
13,,cause_effect_prior,"""All of the rocks burnt.""",Do you think Eric is describing a normal event?,Ronald,object_low,M,15,rocks,burnt,Ronald threw  15 rocks  into a fire.,All,3838,threw __ into a fire,yes,M,32
14,dogs don&quotechart eat seeds,cause_effect_prior,"""Some of the dogs ate the seeds.""",Do you think John is describing a normal event?,William,object_low,M,15,dogs,ate the seeds,William left seeds out for  15 dogs.,Some,21584,left seeds out for __,no,M,3
14,bicyclists can&quotechart honk,cause_effect_prior,"""None of the bicyclists honked.""",Do you think Donna is describing a normal event?,Emily,object_low,F,15,bicyclists,honked,Emily cut off  15 bicyclists.,None,23482,cut off __,no,F,4
14,books shouldn&quotechart be discarded in a fire,cause_effect_prior,"""Nothing surprising there.""",Do you think David is describing a normal event?,Jonathan,object_mid,M,15,books,burnt,Jonathan threw  15 books  into a fire.,short_filler,16419,threw __ into a fire,no,M,5
14,"Spilling nail polish is normal, but not 15 times",cause_effect_prior,"""All of the white carpets got stained.""",Do you think Joyce is describing a normal event?,Emily,object_high,F,15,white carpets,got stained,Emily spilled red nail polish on  15 white carpets.,All,30461,spilled red nail polish on __,no,F,6
14,"people punch other items or people, not shelves",cause_effect_prior,"""Some people just love destruction.""",Do you think Sharon is describing a normal event?,Kimberly,object_low,F,15,shelves,fell down,Kimberly punched  15 shelves.,long_filler,30417,punched __,no,F,7
14,,cause_effect_prior,"""Some of the hats blew away.""",Do you think Donald is describing a normal event?,Jessica,object_mid,F,15,hats,blew away,Jessica left  15 hats  on a table on a windy day.,Some,11826,left __ on a table on a windy day,yes,M,8
14,the probability that none of the glasses broke is rare,cause_effect_prior,"""None of the sunglasses broke.""",Do you think Gregory is describing a normal event?,Carol,object_high,F,15,sunglasses,broke,Carol ran  15 sunglasses  over with a car.,None,18693,ran __ over with a car,no,M,9
14,,cause_effect_prior,"""Some of the sequins stuck.""",Do you think Michelle is describing a normal event?,Amanda,object_mid,F,15,sequins,stuck,Amanda glued  15 sequins  to a piece of paper.,Some,5599,glued __ to a piece of paper,yes,F,10
14,,cause_effect_prior,"""None of the bottles of hand soap froze.""",Do you think Jeffrey is describing a normal event?,Dennis,object_low,M,15,bottles of hand soap,froze,Dennis put  15 bottles of hand soap  in the freezer.,None,5637,put __ in the freezer,yes,M,11
14,,cause_effect_prior,"""Some of the pieces of gum stuck to the wall.""",Do you think Raymond is describing a normal event?,Emma,object_high,F,15,pieces of gum,stuck to the wall,Emma threw  15 pieces of gum  against a wall.,Some,4102,threw __ against a wall,yes,M,12
14,,cause_effect_prior,"""That&quotechars not very good for the environment.""",Do you think Kathleen is describing a normal event?,Amy,object_mid,F,15,old cars,beeped,Amy left the lights on in  15 old cars.,long_filler,8608,left the lights on in __,yes,F,13
14,balloons are very large and thus very easy to poke,cause_effect_prior,"""That requires a lot of concentration.""",Do you think Sarah is describing a normal event?,Virginia,object_mid,F,15,balloons,popped,Virginia poked  15 balloons  with a pin.,long_filler,25378,poked __ with a pin,no,F,14
14,,cause_effect_prior,"""All of the pinecones decomposed.""",Do you think Lisa is describing a normal event?,Heather,object_mid,F,15,pinecones,decomposed,Heather put  15 pinecones  in a compost pile for a month.,All,6619,put __ in a compost pile for a month,yes,F,15
14,,cause_effect_prior,"""It&quotechars so pretty.""",Do you think Paul is describing a normal event?,Jerry,object_mid,M,15,songs,rhymed,Jerry wrote  15 songs.,long_filler,3331,wrote __,yes,M,16
14,,cause_effect_prior,"""All of the sugar cubes dissolved.""",Do you think Mark is describing a normal event?,Elizabeth,object_high,F,15,sugar cubes,dissolved,Elizabeth put  15 sugar cubes  in a bucket of water.,All,4710,put __ in a bucket of water,yes,M,17
14,,cause_effect_prior,"""Why not just take them inside?""",Do you think Frank is describing a normal event?,Michael,object_low,M,15,phone screens,reflected the sunlight,Michael placed  15 phone screens  in the sun.,long_filler,6119,placed __ in the sun,yes,M,18
14,,cause_effect_prior,"""Nothing out of the ordinary.""",Do you think Justin is describing a normal event?,Anna,object_mid,F,15,crayons,melted,Anna left  15 crayons  in the hot sun.,short_filler,13510,left __ in the hot sun,yes,M,19
14,,cause_effect_prior,"""As usual.""",Do you think Cynthia is describing a normal event?,Ashley,object_low,F,15,phones,ran out of batteries,Ashley left  15 phones  on (and unplugged) all day.,short_filler,8926,left __ on (and unplugged) all day,yes,F,20
14,,cause_effect_prior,"""Some of the kids laughed.""",Do you think Laura is describing a normal event?,Jack,object_high,M,15,kids,laughed,Jack told a joke to  15 kids.,Some,3430,told a joke to __,yes,F,21
14,it seems like at least one of the flashlights should work,cause_effect_prior,"""None of the flashlights lit up.""",Do you think Scott is describing a normal event?,Ryan,object_high,M,15,flashlights,lit up,Ryan pressed the &quotecharon&quotechar button on  15 flashlights.,None,18727,pressed the &quotecharon&quotechar button on __,no,M,22
14,,cause_effect_prior,"""None of the candles exploded.""",Do you think Nicholas is describing a normal event?,Jennifer,object_low,F,15,candles,exploded,Jennifer lit  15 candles.,None,5902,lit __,yes,M,23
14,,cause_effect_prior,"""All of the phones flashed.""",Do you think Joseph is describing a normal event?,Shirley,object_mid,F,15,phones,flashed,Shirley took a picture with  15 phones.,All,4350,took a picture with __,yes,M,24
14,,cause_effect_prior,"""Some of the novels had the letter Z in them.""",Do you think James is describing a normal event?,Brandon,object_high,M,15,novels,had the letter Z in them,Brandon wrote  15 novels.,Some,4579,wrote __,yes,M,25
14,,cause_effect_prior,"""Typical.""",Do you think Nancy is describing a normal event?,Gary,object_mid,M,15,motorcycles,stopped,Gary pressed the brakes on  15 motorcycles.,short_filler,4399,pressed the brakes on __,yes,F,26
14,,cause_effect_prior,"""All of the shoes ripped.""",Do you think Larry is describing a normal event?,Nicole,object_low,F,15,shoes,ripped,Nicole used  15 shoes  as dog toys.,All,4530,used __ as dog toys,yes,M,27
14,,cause_effect_prior,"""Some of the clovers were green.""",Do you think Anthony is describing a normal event?,Andrew,object_high,M,15,clovers,were green,Andrew saw  15 clovers.,Some,5151,saw __,yes,M,28
14,,cause_effect_prior,"""Some of the wheelchairs rolled.""",Do you think Ruth is describing a normal event?,Sandra,object_high,F,15,wheelchairs,rolled,Sandra pushed  15 wheelchairs.,Some,11455,pushed __,yes,F,29
14,,cause_effect_prior,"""Some of the eggs exploded.""",Do you think Christopher is describing a normal event?,Robert,object_high,M,15,eggs,exploded,Robert heated up  15 eggs  in a microwave.,Some,3382,heated up __ in a microwave,yes,M,30
14,it seems like all the coins should land flat; it seems very unlikely a coin would land on its side.,cause_effect_prior,"""Some of the coins landed flat.""",Do you think Rebecca is describing a normal event?,Susan,object_high,F,15,coins,landed flat,Susan tossed  15 coins.,Some,36422,tossed __,no,F,31
14,marbles don&quotechart belong in a pool,cause_effect_prior,"""Pretty normal.""",Do you think Betty is describing a normal event?,Benjamin,object_high,M,15,marbles,sank,Benjamin threw  15 marbles  into a pool.,short_filler,19870,threw __ into a pool,no,F,32
15,,cause_effect_prior,"""Some of the card towers fell down.""",Do you think Jerry is describing a normal event?,Sharon,object_high,F,15,card towers,fell down,Sharon punched  15 card towers.,Some,41171,punched __,yes,M,3
15,throwing a cake against a wall isn&quotechart normal.,cause_effect_prior,"""Typical.""",Do you think Frank is describing a normal event?,Betty,object_mid,F,15,cakes,stuck to the wall,Betty threw  15 cakes  against a wall.,short_filler,54428,threw __ against a wall,no,M,4
15,,cause_effect_prior,"""It&quotechars a beautiful day.""",Do you think Ryan is describing a normal event?,Joyce,object_low,F,15,pencils,melted,Joyce left  15 pencils  in the hot sun.,long_filler,26457,left __ in the hot sun,yes,M,5
15,Brakes are supposed to stop a vehicle.,cause_effect_prior,"""None of the motorcycles stopped.""",Do you think Donald is describing a normal event?,David,object_mid,M,15,motorcycles,stopped,David pressed the brakes on  15 motorcycles.,None,61377,pressed the brakes on __,no,M,6
15,,cause_effect_prior,"""All of the eggs exploded.""",Do you think Charles is describing a normal event?,Sarah,object_high,F,15,eggs,exploded,Sarah heated up  15 eggs  in a microwave.,All,12150,heated up __ in a microwave,yes,M,7
15,,cause_effect_prior,"""None of the pinecones decomposed.""",Do you think Amanda is describing a normal event?,Scott,object_mid,M,15,pinecones,decomposed,Scott put  15 pinecones  in a compost pile for a month.,None,5968,put __ in a compost pile for a month,yes,F,8
15,,cause_effect_prior,"""All of the poems rhymed.""",Do you think James is describing a normal event?,Stephanie,object_low,F,15,poems,rhymed,Stephanie wrote  15 poems.,All,5846,wrote __,yes,M,9
15,,cause_effect_prior,"""None of the cups sank.""",Do you think Emily is describing a normal event?,Jessica,object_mid,F,15,cups,sank,Jessica threw  15 cups  into a pool.,None,3792,threw __ into a pool,yes,F,10
15,shopping carts normally roll.,cause_effect_prior,"""None of the shopping carts rolled.""",Do you think Timothy is describing a normal event?,Brandon,object_mid,M,15,shopping carts,rolled,Brandon pushed  15 shopping carts.,None,217114,pushed __,no,M,11
15,,cause_effect_prior,"""Some of the bus drivers honked.""",Do you think Samantha is describing a normal event?,Dennis,object_mid,M,15,bus drivers,honked,Dennis cut off  15 bus drivers.,Some,5282,cut off __,yes,F,12
15,,cause_effect_prior,"""Nothing out of the ordinary.""",Do you think Richard is describing a normal event?,Joshua,object_high,M,15,coins,landed flat,Joshua tossed  15 coins.,short_filler,3574,tossed __,yes,M,13
15,,cause_effect_prior,"""Some of the eggs popped.""",Do you think Susan is describing a normal event?,Heather,object_low,F,15,eggs,popped,Heather poked  15 eggs  with a pin.,Some,3998,poked __ with a pin,yes,F,14
15,chocolate does freeze.,cause_effect_prior,"""None of the chocolate bars froze.""",Do you think Michael is describing a normal event?,Amy,object_mid,F,15,chocolate bars,froze,Amy put  15 chocolate bars  in the freezer.,None,16875,put __ in the freezer,no,M,15
15,,cause_effect_prior,"""Nothing surprising there.""",Do you think William is describing a normal event?,Sandra,object_high,F,15,new cars,beeped,Sandra left the lights on in  15 new cars.,short_filler,4682,left the lights on in __,yes,M,16
15,Brenda doesn&quotechart eat seeds.,cause_effect_prior,"""I wish someone would leave seeds out for me.""",Do you think Brenda is describing a normal event?,Carolyn,object_mid,F,15,butterflies,ate the seeds,Carolyn left seeds out for  15 butterflies.,long_filler,18415,left seeds out for __,no,F,17
15,,cause_effect_prior,"""All of the phones flashed.""",Do you think Matthew is describing a normal event?,Lisa,object_mid,F,15,phones,flashed,Lisa took a picture with  15 phones.,All,6350,took a picture with __,yes,M,18
15,,cause_effect_prior,"""Some of the hats blew away.""",Do you think Angela is describing a normal event?,George,object_mid,M,15,hats,blew away,George left  15 hats  on a table on a windy day.,Some,3151,left __ on a table on a windy day,yes,F,19
15,logs are not normally in a driveway.,cause_effect_prior,"""Why does Lucy always leave her stuff in the driveway?""",Do you think Karen is describing a normal event?,Paul,object_low,M,15,logs,broke,Paul ran  15 logs  over with a car.,long_filler,20159,ran __ over with a car,no,F,20
15,,cause_effect_prior,"""As usual.""",Do you think Virginia is describing a normal event?,Rebecca,object_high,F,15,books,ripped,Rebecca used  15 books  as dog toys.,short_filler,3076,used __ as dog toys,yes,F,21
15,,cause_effect_prior,"""I love watching fires.""",Do you think Carol is describing a normal event?,Jonathan,object_low,M,15,rocks,burnt,Jonathan threw  15 rocks  into a fire.,long_filler,3537,threw __ into a fire,yes,F,22
15,,cause_effect_prior,"""Some of the fireworks exploded.""",Do you think Christopher is describing a normal event?,Brian,object_mid,M,15,fireworks,exploded,Brian lit  15 fireworks.,Some,3063,lit __,yes,M,23
15,,cause_effect_prior,"""Some of the computers lit up.""",Do you think Raymond is describing a normal event?,Ronald,object_mid,M,15,computers,lit up,Ronald pressed the &quotecharon&quotechar button on  15 computers.,Some,5135,pressed the &quotecharon&quotechar button on __,yes,M,24
15,,cause_effect_prior,"""Some of the kids laughed.""",Do you think Gary is describing a normal event?,Donna,object_high,F,15,kids,laughed,Donna told a joke to  15 kids.,Some,3713,told a joke to __,yes,M,25
15,,cause_effect_prior,"""Some of the white tablecloths got stained.""",Do you think Helen is describing a normal event?,Diane,object_low,F,15,white tablecloths,got stained,Diane spilled red nail polish on  15 white tablecloths.,Some,6165,spilled red nail polish on __,yes,F,26
15,,cause_effect_prior,"""All of the sequins stuck.""",Do you think Laura is describing a normal event?,Edward,object_mid,M,15,sequins,stuck,Edward glued  15 sequins  to a piece of paper.,All,3159,glued __ to a piece of paper,yes,F,27
15,,cause_effect_prior,"""Pretty normal.""",Do you think Anna is describing a normal event?,Benjamin,object_mid,M,15,bananas,were green,Benjamin saw  15 bananas.,short_filler,3751,saw __,yes,F,28
15,,cause_effect_prior,"""Some of the birthday cards had the letter Z in them.""",Do you think Janet is describing a normal event?,Jeffrey,object_low,M,15,birthday cards,had the letter Z in them,Jeffrey wrote  15 birthday cards.,Some,5510,wrote __,yes,F,29
15,,cause_effect_prior,"""There are people starving in the world.""",Do you think Patrick is describing a normal event?,Samuel,object_mid,M,15,oreos,dissolved,Samuel put  15 oreos  in a bucket of water.,long_filler,5791,put __ in a bucket of water,yes,M,30
15,,cause_effect_prior,"""Some of the laptops ran out of batteries.""",Do you think Thomas is describing a normal event?,Mary,object_high,F,15,laptops,ran out of batteries,Mary left  15 laptops  on (and unplugged) all day.,Some,4919,left __ on (and unplugged) all day,yes,M,31
15,,cause_effect_prior,"""All of the diamonds reflected the sunlight.""",Do you think Jacob is describing a normal event?,Ruth,object_mid,F,15,diamonds,reflected the sunlight,Ruth placed  15 diamonds  in the sun.,All,3295,placed __ in the sun,yes,M,32
16,,cause_effect_prior,"""Some of the webcams flashed.""",Do you think Ruth is describing a normal event?,Christina,object_low,F,15,webcams,flashed,Christina took a picture with  15 webcams.,Some,16295,took a picture with __,yes,F,3
16,"Usually pencils are used indoors in a classroom, where it usually isn&quotechart under the hot sun. ",cause_effect_prior,"""It&quotechars a beautiful day.""",Do you think Linda is describing a normal event?,Ashley,object_low,F,15,pencils,melted,Ashley left  15 pencils  in the hot sun.,long_filler,96982,left __ in the hot sun,no,F,4
16,Things usually burn when you throw them into fire. ,cause_effect_prior,"""None of the books burnt.""",Do you think Brandon is describing a normal event?,Heather,object_mid,F,15,books,burnt,Heather threw  15 books  into a fire.,None,24839,threw __ into a fire,no,M,5
16,Things usually freeze when you put them in the freezer. ,cause_effect_prior,"""None of the berries froze.""",Do you think Jessica is describing a normal event?,Carol,object_high,F,15,berries,froze,Carol put  15 berries  in the freezer.,None,25174,put __ in the freezer,no,F,6
16,,cause_effect_prior,"""As usual.""",Do you think Emily is describing a normal event?,Raymond,object_high,M,15,sugar cubes,dissolved,Raymond put  15 sugar cubes  in a bucket of water.,short_filler,7824,put __ in a bucket of water,yes,F,7
16,,cause_effect_prior,"""Nothing surprising there.""",Do you think Kimberly is describing a normal event?,James,object_mid,M,15,pancakes,landed flat,James tossed  15 pancakes.,short_filler,5520,tossed __,yes,F,8
16,,cause_effect_prior,"""All of the pinecones decomposed.""",Do you think Melissa is describing a normal event?,Anna,object_mid,F,15,pinecones,decomposed,Anna put  15 pinecones  in a compost pile for a month.,All,8214,put __ in a compost pile for a month,yes,F,9
16,,cause_effect_prior,"""Nothing out of the ordinary.""",Do you think Timothy is describing a normal event?,Sharon,object_mid,F,15,motorcycles,stopped,Sharon pressed the brakes on  15 motorcycles.,short_filler,7256,pressed the brakes on __,yes,M,10
16,,cause_effect_prior,"""All of the dogs ate the seeds.""",Do you think Daniel is describing a normal event?,Helen,object_low,F,15,dogs,ate the seeds,Helen left seeds out for  15 dogs.,All,10889,left seeds out for __,yes,M,11
16,,cause_effect_prior,"""All of the phones ran out of batteries.""",Do you think Mark is describing a normal event?,Cynthia,object_low,F,15,phones,ran out of batteries,Cynthia left  15 phones  on (and unplugged) all day.,All,11606,left __ on (and unplugged) all day,yes,M,12
16,Card towers are usually fragile and would fall to a slight push. ,cause_effect_prior,"""None of the card towers fell down.""",Do you think Gary is describing a normal event?,Catherine,object_high,F,15,card towers,fell down,Catherine punched  15 card towers.,None,43336,punched __,no,M,13
16,,cause_effect_prior,"""Some of the bubbles popped.""",Do you think Kathleen is describing a normal event?,Anthony,object_high,M,15,bubbles,popped,Anthony poked  15 bubbles  with a pin.,Some,10087,poked __ with a pin,yes,F,14
16,,cause_effect_prior,"""Typical.""",Do you think Rachel is describing a normal event?,Andrew,object_high,M,15,eggs,exploded,Andrew heated up  15 eggs  in a microwave.,short_filler,4807,heated up __ in a microwave,yes,F,15
16,,cause_effect_prior,"""Why not just take them inside?""",Do you think Joyce is describing a normal event?,Ryan,object_low,M,15,phone screens,reflected the sunlight,Ryan placed  15 phone screens  in the sun.,long_filler,8751,placed __ in the sun,yes,F,16
16,,cause_effect_prior,"""It looks like a zebra.""",Do you think Charles is describing a normal event?,Carolyn,object_high,F,15,stickers,stuck,Carolyn glued  15 stickers  to a piece of paper.,long_filler,8816,glued __ to a piece of paper,yes,M,17
16,,cause_effect_prior,"""That&quotechars not very good for the environment.""",Do you think Jason is describing a normal event?,Kevin,object_mid,M,15,old cars,beeped,Kevin left the lights on in  15 old cars.,long_filler,7543,left the lights on in __,yes,M,18
16,,cause_effect_prior,"""Some of the logs broke.""",Do you think Lisa is describing a normal event?,John,object_low,M,15,logs,broke,John ran  15 logs  over with a car.,Some,8160,ran __ over with a car,yes,F,19
16,,cause_effect_prior,"""Some of the pieces of gum stuck to the wall.""",Do you think Jacob is describing a normal event?,Angela,object_high,F,15,pieces of gum,stuck to the wall,Angela threw  15 pieces of gum  against a wall.,Some,4847,threw __ against a wall,yes,M,20
16,,cause_effect_prior,"""Some of the cups sank.""",Do you think Brenda is describing a normal event?,George,object_mid,M,15,cups,sank,George threw  15 cups  into a pool.,Some,5295,threw __ into a pool,yes,F,21
16,,cause_effect_prior,"""Some of the limericks rhymed.""",Do you think Robert is describing a normal event?,Amanda,object_high,F,15,limericks,rhymed,Amanda wrote  15 limericks.,Some,5343,wrote __,yes,M,22
16,,cause_effect_prior,"""All of the books ripped.""",Do you think Alexander is describing a normal event?,Donald,object_high,M,15,books,ripped,Donald used  15 books  as dog toys.,All,9960,used __ as dog toys,yes,M,23
16,,cause_effect_prior,"""Some of the white carpets got stained.""",Do you think Paul is describing a normal event?,Joseph,object_high,M,15,white carpets,got stained,Joseph spilled red nail polish on  15 white carpets.,Some,11136,spilled red nail polish on __,yes,M,24
16,,cause_effect_prior,"""None of the lawyers laughed.""",Do you think Larry is describing a normal event?,Rebecca,object_low,F,15,lawyers,laughed,Rebecca told a joke to  15 lawyers.,None,24773,told a joke to __,yes,M,25
16,,cause_effect_prior,"""Some of the clovers were green.""",Do you think Susan is describing a normal event?,Sandra,object_high,F,15,clovers,were green,Sandra saw  15 clovers.,Some,14399,saw __,yes,F,26
16,,cause_effect_prior,"""Pretty normal.""",Do you think Margaret is describing a normal event?,Amy,object_mid,F,15,bus drivers,honked,Amy cut off  15 bus drivers.,short_filler,6032,cut off __,yes,F,27
16,,cause_effect_prior,"""All of the napkins blew away.""",Do you think Betty is describing a normal event?,Laura,object_high,F,15,napkins,blew away,Laura left  15 napkins  on a table on a windy day.,All,9222,left __ on a table on a windy day,yes,F,28
16,,cause_effect_prior,"""I just don&quotechart have the patience to write one of those.""",Do you think William is describing a normal event?,Jeffrey,object_low,M,15,birthday cards,had the letter Z in them,Jeffrey wrote  15 birthday cards.,long_filler,9768,wrote __,yes,M,29
16,Usually a gas tank would have some gas left in it and would explode when lit. ,cause_effect_prior,"""None of the gas tanks exploded.""",Do you think Julie is describing a normal event?,Matthew,object_high,M,15,gas tanks,exploded,Matthew lit  15 gas tanks.,None,41807,lit __,no,F,30
16,,cause_effect_prior,"""Some of the shopping carts rolled.""",Do you think Sarah is describing a normal event?,Stephanie,object_mid,F,15,shopping carts,rolled,Stephanie pushed  15 shopping carts.,Some,7383,pushed __,yes,F,31
16,,cause_effect_prior,"""Some of the flashlights lit up.""",Do you think Karen is describing a normal event?,Christopher,object_high,M,15,flashlights,lit up,Christopher pressed the &quotecharon&quotechar button on  15 flashlights.,Some,6896,pressed the &quotecharon&quotechar button on __,yes,F,32
17,,cause_effect_prior,"""Some of the sequins stuck.""",Do you think Cynthia is describing a normal event?,Mark,object_mid,M,15,sequins,stuck,Mark glued  15 sequins  to a piece of paper.,Some,37651,glued __ to a piece of paper,yes,F,3
17,,cause_effect_prior,"""Some of the kids laughed.""",Do you think Jack is describing a normal event?,Amanda,object_high,F,15,kids,laughed,Amanda told a joke to  15 kids.,Some,10330,told a joke to __,yes,M,4
17,,cause_effect_prior,"""What a strange thing to do.""",Do you think Deborah is describing a normal event?,Joyce,object_mid,F,15,cakes,stuck to the wall,Joyce threw  15 cakes  against a wall.,long_filler,13113,threw __ against a wall,yes,F,5
17,,cause_effect_prior,"""All of the pancakes landed flat.""",Do you think Frank is describing a normal event?,Patrick,object_mid,M,15,pancakes,landed flat,Patrick tossed  15 pancakes.,All,12390,tossed __,yes,M,6
17,All of the ice cubes shouldve melted.,cause_effect_prior,"""Some of the ice cubes melted.""",Do you think Rachel is describing a normal event?,Emily,object_high,F,15,ice cubes,melted,Emily left  15 ice cubes  in the hot sun.,Some,21159,left __ in the hot sun,no,F,7
17,All the berries should have froze.,cause_effect_prior,"""Some of the berries froze.""",Do you think Susan is describing a normal event?,Gary,object_high,M,15,berries,froze,Gary put  15 berries  in the freezer.,Some,32579,put __ in the freezer,no,F,8
17,,cause_effect_prior,"""Pretty normal.""",Do you think Brandon is describing a normal event?,John,object_high,M,15,banana peels,decomposed,John put  15 banana peels  in a compost pile for a month.,short_filler,12458,put __ in a compost pile for a month,yes,M,9
17,,cause_effect_prior,"""None of the new cars beeped.""",Do you think Carol is describing a normal event?,Jessica,object_high,F,15,new cars,beeped,Jessica left the lights on in  15 new cars.,None,17601,left the lights on in __,yes,F,10
17,,cause_effect_prior,"""Some of the white tablecloths got stained.""",Do you think Thomas is describing a normal event?,Anna,object_low,F,15,white tablecloths,got stained,Anna spilled red nail polish on  15 white tablecloths.,Some,10036,spilled red nail polish on __,yes,M,11
